{
  "schema_version": "1.0.0",
  "work_id": "work://series/project-hearthway-main",
  "display_code": "SER-001",
  "title": "Project Hearthway Main Series",
  "work_type": "SERIES",
  "mode": "AUTHORING",
  "canonicality": "PROPOSED",
  "promotion": "ALLOWED_WITH_AUTHOR_GATE",
  "work_root": "stories/series/project-hearthway-main",
  "contract_path": "stories/series/project-hearthway-main/work-contract.md",
  "characters_root": "stories/series/project-hearthway-main/characters",
  "world_overlay_root": "stories/series/project-hearthway-main/world-overlay",
  "context_packs_root": "stories/series/project-hearthway-main/workbench/context-packs",
  "runs_root": "stories/series/project-hearthway-main/workbench/runs",
  "setting_scope": "SHARED_WORLD",
  "shared_setting_id": "setting://shared-universe-001",
  "adopted_shared_world_refs": [
    "author-decision://world/WLD-SETTING-001A",
    "canon://world/shared-universe-001/ecology/lineage-ii-vegetation-architects",
    "canon://world/shared-universe-001/ecology/lineage-ii-fermentation-lattice",
    "canon://world/shared-universe-001/ecology/lineage-ii-symbiont-inheritance",
    "canon://world/shared-universe-001/ecology/lineage-ii-peripheral-migration-corridor",
    "canon://world/shared-universe-001/ecology/basin-coupled-pulse-mosaic-exchange",
    "canon://world/shared-universe-001/ecology/basin-lake-spring-breeding-pulse",
    "canon://world/shared-universe-001/ecology/basin-lake-mass-breeder-foundational-body-plan",
    "canon://world/shared-universe-001/ecology/basin-lake-mass-breeder-osmoregulation-buoyancy-balance",
    "canon://world/shared-universe-001/ecology/basin-lake-family-care-migrant-foundational-body-plan",
    "canon://world/shared-universe-001/ecology/basin-lake-family-care-migrant-outlet-passage-choreography",
    "canon://world/shared-universe-001/geography/initial-region-physical-scaffold",
    "canon://world/shared-universe-001/geography/initial-outlet-mixed-reach-sequence",
    "canon://world/shared-universe-001/location/initial-ridge-spur-settlement-working-landscape",
    "canon://world/shared-universe-001/location/initial-ridge-spur-lake-road-practical-travel-scale",
    "canon://world/shared-universe-001/location/initial-ridge-spur-lake-road-shore-endpoint-arrangement",
    "canon://world/shared-universe-001/ecology/basin-reserve-web-vegetation-guild",
    "canon://world/shared-universe-001/ecology/basin-reserve-web-modular-colonies",
    "canon://world/shared-universe-001/ecology/basin-reserve-web-fragment-viability"
  ],
  "adopted_default_guardrails": [],
  "shared_read_only_authorities": [
    "governance/",
    "litrpg-system/cal0/"
  ],
  "created_on": "2026-08-13",
  "accepted_on": null,
  "approval_decision_uri": null
}
