{
  "schema_version": "1.0.0",
  "work_id": "work://experiment/fixture",
  "display_code": "FIX-EVAL-001",
  "title": "Noncanonical validator fixture work",
  "work_type": "EXPERIMENT",
  "mode": "EVALUATION",
  "canonicality": "NONCANONICAL_EVALUATION_ONLY",
  "promotion": "FORBIDDEN",
  "work_root": "litrpg-system/story-integration/fixtures",
  "contract_path": "litrpg-system/story-integration/fixtures/valid/fixture-experiment.work-manifest.json",
  "characters_root": "litrpg-system/story-integration/fixtures/characters",
  "world_overlay_root": "litrpg-system/story-integration/fixtures/world-overlay",
  "context_packs_root": "litrpg-system/story-integration/fixtures/context-packs",
  "runs_root": "litrpg-system/story-integration/fixtures/runs",
  "setting_scope": "INDEPENDENT_SETTING",
  "shared_setting_id": null,
  "adopted_shared_world_refs": [],
  "adopted_default_guardrails": [],
  "shared_read_only_authorities": ["governance/", "litrpg-system/cal0/"],
  "created_on": "2026-08-12",
  "accepted_on": null,
  "approval_decision_uri": null
}
