{
  "schema_version": "1.0.0",
  "work_id": "work://series/first-awakening",
  "display_code": "FIX-SER-001",
  "title": "First Awakening fixture",
  "work_type": "SERIES",
  "mode": "AUTHORING",
  "canonicality": "ACCEPTED",
  "promotion": "ALLOWED_WITH_AUTHOR_GATE",
  "work_root": "litrpg-system/story-integration/fixtures/valid",
  "contract_path": "litrpg-system/story-integration/fixtures/valid/first-awakening.work-manifest.json",
  "characters_root": "litrpg-system/story-integration/fixtures/valid/characters",
  "world_overlay_root": "litrpg-system/story-integration/fixtures/valid/world-overlay",
  "context_packs_root": "litrpg-system/story-integration/fixtures/valid/context-packs",
  "runs_root": "litrpg-system/story-integration/fixtures/valid/runs",
  "setting_scope": "SHARED_WORLD",
  "shared_setting_id": "setting://shared-first-awakening",
  "adopted_shared_world_refs": [],
  "adopted_default_guardrails": [],
  "shared_read_only_authorities": ["governance/", "litrpg-system/cal0/"],
  "created_on": "2026-08-12",
  "accepted_on": "2026-08-12",
  "approval_decision_uri": "author-decision://repository/REP0.1A"
}
